
title,url,points,author,age,comments
Rsync replaced with openrsync on macOS Sequoia,https://derflounder.wordpress.com/2025/04/06/rsync-replaced-with-openrsync-on-macos-sequoia/,330,zdw,11 hours ago,255
AI masters Minecraft: DeepMind program finds diamonds without being taught,https://www.nature.com/articles/d41586-025-01019-w,61,LinuxBender,5 hours ago,30
Glamorous Toolkit,https://gtoolkit.com//,152,radeeyate,9 hours ago,33
We asked camera companies why their RAW formats are all different and confusing,https://www.theverge.com/tech/640119/camera-raw-spec-format-explained-adobe-dng-canon-nikon-sony-fujifilm,113,Tomte,8 hours ago,36
Writing C for Curl,https://daniel.haxx.se/blog/2025/04/07/writing-c-for-curl/,46,TangerineDream,2 hours ago,4
A Multiwavelength Look at Proxima Centauri's Flares,https://www.centauri-dreams.org/2025/04/01/a-multiwavelength-look-at-proxima-centauris-flares/,11,JPLeRouzic,4 hours ago,1
New Theoretical Research Trends in Cartography (2001),https://www.researchgate.net/publication/26467883_NEW_THEORETICAL_RESEARCH_TRENDS_IN_CARTOGRAPHY,29,bryanrasmussen,8 hours ago,7
"Standard Ebooks: liberated ebooks, carefully produced for the true book lover",https://standardebooks.org,1085,tosh,1 day ago,222
How the Atlantic's Jeffrey Goldberg Got Added to the White House Signal Chat,https://www.theguardian.com/us-news/2025/apr/06/signal-group-chat-leak-how-it-happened,183,howard941,19 hours ago,128
Journey to Optimize Cloudflare D1 Database Queries,https://gist.github.com/rxliuli/be31cbded41ef7eac6ae0da9070c8ef8,49,rxliuli,9 hours ago,10
Charging electric vehicles 5x faster in subfreezing temps,https://news.umich.edu/charging-electric-vehicles-5x-faster-in-subfreezing-temps/,76,gnabgib,15 hours ago,50
Dark Mirror Ideologies,https://www.fortressofdoors.com/dark-mirror-ideologies/,54,surprisetalk,5 hours ago,41
Reinventing Feathering for the Vectorian Era,https://rive.app/blog/how-rive-reinvented-feathering-for-the-vectorian-era,49,interpol_p,12 hours ago,7
Microcomputers – The First Wave: Responding to Altair,https://technicshistory.com/2025/04/06/microcomputers-the-first-wave-responding-to-altair/,49,cfmcdonald,11 hours ago,3
Stay on schedule with Raspberry Pi Pico W and an e-ink dashboard,https://www.raspberrypi.com/news/stay-on-schedule-with-raspberry-pi-pico-w-and-an-e-ink-dashboard/,35,Brajeshwar,2 hours ago,2
Anagram Word Game,https://codingjlu.github.io/anagram/,27,codingjlu,8 hours ago,9
AEgIS turns phone sensors into antimatter camera of unprecedented resolution,https://home.cern/news/news/experiments/aegis-transforms-smartphone-sensors-antimatter-camera-unprecedented,32,rbanffy,10 hours ago,7
Benchmarking LLM social skills with an elimination game,https://github.com/lechmazur/elimination_game,3,colonCapitalDee,3 hours ago,0
Use the Gemini API with OpenAI Fallback in TypeScript,https://sometechblog.com/posts/try-gemini-api-with-openai-fallback/,38,l5870uoo9y,12 hours ago,24
The “S” in MCP Stands for Security,https://elenacross7.medium.com/%EF%B8%8F-the-s-in-mcp-stands-for-security-91407b33ed6b,616,skilldeliver,23 hours ago,154
MonkeysPaw – A prompt-driven web framework in Ruby,https://worksonmymachine.substack.com/p/introducing-monkeyspaw-a-prompt-driven,66,daviducolo,18 hours ago,15
Knowing where your engineer salary comes from,https://www.seangoedecke.com/where-the-money-comes-from/,43,mooreds,14 hours ago,13
Baby Steps into Genetic Programming,https://aerique.blogspot.com/2011/01/baby-steps-into-genetic-programming.html,52,todsacerdoti,10 hours ago,21
Recent AI model progress feels mostly like bullshit,https://www.lesswrong.com/posts/4mvphwx5pdsZLMmpY/recent-ai-model-progress-feels-mostly-like-bullshit,369,paulpauper,15 hours ago,298
Why Lotus Domino? (2024),http://www.moohar.com/blog/why_domino,79,wonger_,9 hours ago,44
Food fermentation in space: Opportunities and challenges,https://www.cell.com/iscience/fulltext/S2589-0042(25)00450-X,8,bookofjoe,6 hours ago,0
Breaking computers taught me to build them,https://danielsada.tech/blog/carreer-part-1-the-foundation-years/,79,dshacker,18 hours ago,55
Data centers contain 90% crap data,https://gerrymcgovern.com/data-centers-contain-90-crap-data/,136,billybuckwheat,10 hours ago,92
Eavesdropping on smartphone 13.56MHz NFC polling during screen wake-up/unlock,https://old.reddit.com/r/RTLSDR/comments/1jsr9jv/eavesdropping_on_smartphone_1356mhz_nfc_polling/,152,byry,10 hours ago,32
Foundry (YC F24) Is Hiring,https://www.ycombinator.com/companies/foundry/jobs/WvDDlqc-founding-fullstack-engineer-building-the-future-of-browser-agents,0,,16 hours ago,0
"Thomas Rattigan, short-lived Commodore CEO",https://dfarq.homeip.net/thomas-rattigan-short-lived-commodore-ceo/,61,rbanffy,20 hours ago,18
"The booming, high-stakes arms race of airline safety videos",https://thehustle.co/originals/the-booming-high-stakes-arms-race-of-airline-safety-videos,72,gmays,11 hours ago,52
The Insanity of Being a Software Engineer,https://0x1.pt/2025/04/06/the-insanity-of-being-a-software-engineer/,108,vmsp,21 hours ago,145
Max severity RCE flaw discovered in widely used Apache Parquet,https://www.bleepingcomputer.com/news/security/max-severity-rce-flaw-discovered-in-widely-used-apache-parquet/,154,andy99,15 hours ago,68
Show HN: LocalScore – Local LLM Benchmark,https://www.localscore.ai/download,103,sipjca,22 hours ago,12
Show HN: I built a Rust crate for running unsafe code safely,https://github.com/brannondorsey/mem-isolate,105,braxxox,19 hours ago,59
Apple’s Darwin OS and XNU Kernel Deep Dive,https://tansanrao.com/blog/2025/04/xnu-kernel-and-darwin-evolution-and-architecture/,452,tansanrao,1 day ago,165
Pitfalls of Safe Rust,https://corrode.dev/blog/pitfalls-of-safe-rust/,147,pjmlp,17 hours ago,120
Neutron Stars Hint at Another Dimension,https://nautil.us/neutron-stars-hint-at-another-dimension-1202180/,158,dnetesn,21 hours ago,61
Visual Perception in the Brain of a Jumping Spider(2014),https://www.cell.com/current-biology/fulltext/S0960-9822(14)01150-6,12,rolph,10 hours ago,1
Circuit breaker triggered in Japan for stock futures trading,https://www.wsj.com/livecoverage/stock-market-trump-tariffs-trade-war-04-07-25/card/circuit-breaker-triggered-in-japan-for-stock-futures-trading-Q5iMfZyfPGBEslrIObgB,201,perihelions,7 hours ago,201
Cell Death as a Driving Force in Glioblastoma,https://news.feinberg.northwestern.edu/2025/03/27/study-establishes-cell-death-as-a-driving-force-in-glioblastoma/,12,gmays,14 hours ago,1
Lessons from open source in the Mexican government,https://lwn.net/Articles/1013776/,291,signa11,1 day ago,83
QVQ-Max: Think with Evidence,https://qwenlm.github.io/blog/qvq-max-preview/,111,wertyk,23 hours ago,21
"Show HN: A fast, minimal and offline-friendly web playground",https://scriptpad.dev/?id=ybqiqNVknx0aYPMCaTlJ#/fullpage,16,evenoroddman,12 hours ago,3
Russia's secret war in UK waters,https://www.thetimes.com/uk/defence/article/russia-secret-war-uk-waters-submarines-dpbzphfx5,5,AndrewDucker,31 minutes ago,0
The order of files in /etc/ssh/sshd_config.d/ matters,https://utcc.utoronto.ca/~cks/space/blog/sysadmin/OpenSSHConfigOrderMatters,240,NGRhodes,1 day ago,111
Erica Synths DIY Eurorack Modules,https://github.com/erica-synths/diy-eurorack,39,diggan,5 hours ago,4
"US tax return filings drop by nearly 1M, extension requests rise",https://www.cnn.com/2025/04/04/politics/tax-return-filings-deadline-irs/index.html,23,MilnerRoute,7 hours ago,9
Blacksmithing and Lisp,http://funcall.blogspot.com/2025/04/blacksmithing-and-lisp.html,146,082349872349872,1 day ago,71
Z-Wave is remaking itself into an open source protocol,https://www.theverge.com/tech/643328/does-z-wave-still-matter-in-the-smart-home,24,elsewhen,10 hours ago,0
SeedLM: Compressing LLM Weights into Seeds of Pseudo-Random Generators,https://machinelearning.apple.com/research/seedlm-compressing,159,pizza,1 day ago,36
"What's in that bright red fire retardant? No one will say, so we had it tested",https://laist.com/news/climate-environment/how-much-toxic-heavy-metal-is-in-that-bright-red-fire-retardant-we-had-it-tested-to-find-out,171,littlexsparkee,1 day ago,115
Capital Trades: Tracking Stock Market Transactions of Politicians,https://www.capitoltrades.com/,281,gscott,14 hours ago,97
What if we made advertising illegal?,https://simone.org/advertising/,1758,smnrg,1 day ago,1273
Show HN: I built a word game. My mom thinks it's great. What do you think?,https://www.whatsit.today/,475,mkate,1 day ago,243
The Bandwidth of the Starlink Constellation,http://www.satmagazine.com/story.php?number=1026762698,9,rbanffy,11 hours ago,4
"My Browser WASM't Prepared for This. Using DuckDB, Apache Arrow and Web Workers",https://motifanalytics.medium.com/my-browser-wasmt-prepared-for-this-using-duckdb-apache-arrow-and-web-workers-in-real-life-e3dd4695623d,111,jjp,1 day ago,25
"Neurotoxic worms growing up to 3ft long are in Ontario, Canada",https://www.blogto.com/city/2025/04/hammerhead-worms-ontario/,41,amichail,10 hours ago,13
'Minecraft Movie' Leaks Online: Full Unfinished Version Shared,https://variety.com/2025/film/news/minecraft-movie-leaks-online-unfinished-effects-1236360578/,64,austinallegro,13 hours ago,40
What the Comfort Class Doesn't Get,https://www.theatlantic.com/ideas/archive/2025/04/class-money-finances/682301/,24,littlexsparkee,6 hours ago,8
montasaurus/result: A simple Rust-like Result type for Python 3,https://github.com/montasaurus/result,16,networked,18 hours ago,1
"TinyWall is a free, feature-rich, and lightweight firewall for Windows",https://github.com/pylorak/TinyWall,21,CHEF-KOCH,22 hours ago,6
Open Source Coalition Announces 'Model-Signing' to Strengthen ML Supply Chain,https://pypi.org/project/model-signing/,66,m463,1 day ago,11
"Photons, neutrinos, and gravitational-wave astronomy",https://www.as.arizona.edu/~mrenzo/courses/notes-lecture-GWprog.html,45,ninocan,1 day ago,10
Bill to block OpenAI's for-profit conversion gets mysteriously gutted,https://garymarcus.substack.com/p/breaking-bill-that-would-have-blocked,182,konmok,5 hours ago,32
The Llama 4 herd,https://ai.meta.com/blog/llama-4-multimodal-intelligence/,1192,georgehill,1 day ago,631
Hiding elements that require JavaScript without JavaScript,https://0xda.de/blog/2025/04/hiding-elements-that-require-javascript-without-javascript/,62,mtlynch,16 hours ago,45
Scientists witness living plant cells generate cellulose and form cell walls,https://phys.org/news/2025-03-scientists-witness-cells-generate-cellulose.html,103,PaulHoule,2 days ago,2
An image of an archeologist adventurer who wears a hat and uses a bullwhip,https://theaiunderwriter.substack.com/p/an-image-of-an-archeologist-adventurer,1473,participant3,3 days ago,886
GPMI set to deliver up to 192Gbps and 480W through a single USB cable,https://videocardz.com/newz/chinas-general-purpose-media-interface-gpmi-set-to-deliver-up-to-192gb-of-bandwidth-and-480w-power-through-a-single-usb-cable,7,croes,6 hours ago,5
Longtime Writing Community NaNoWriMo Shuts Down After AI Drama,https://gizmodo.com/longtime-writing-community-nanowrimo-shuts-down-after-ai-drama-2000583619,14,gnabgib,8 hours ago,1
Faster interpreters in Go: Catching up with C++,https://planetscale.com/blog/faster-interpreters-in-go-catching-up-with-cpp,236,ksec,1 day ago,50
'OLED and LCD will die out': A MicroLED expert explains how,https://www.techradar.com/televisions/oled-and-lcd-will-die-out-a-microled-expert-explains-how-the-superior-tv-tech-will-finally-become-affordable,15,bentocorp,10 hours ago,7
Why Do Domestic Prices Rise with Tarriffs?,https://marginalrevolution.com/marginalrevolution/2025/04/why-do-domestic-prices-rise-with-tarriffs.html,113,paulpauper,18 hours ago,184
"Rich Text, Poor Text (2013)",https://laemeur.sdf.org/words/D29.html,53,SerCe,1 day ago,27
The Treachery of Image Files (2020),http://beyondloom.com/blog/images.html,29,appleorchard46,14 hours ago,1
"After 'coding error' triggers firings, top NIH scientists called back to work",https://www.science.org/content/article/after-coding-error-triggers-firings-top-nih-scientists-called-back-work,262,pmags,8 hours ago,204
Maurice Hilleman,https://en.wikipedia.org/wiki/Maurice_Hilleman,7,arbuge,6 hours ago,0
Identifying a defective RAM IC on laptops with soldered memory,https://blog.piernov.org/identifying-defective-ram-ic/,48,userbinator,1 day ago,8
Non-US-based alternatives to popular services,https://github.com/anitwek/alternatives-to-us,77,realty_geek,1 day ago,10
Why do plastic containers always come out wet from the dishwasher?,https://theconversation.com/why-do-plastic-containers-always-come-out-wet-from-the-dishwasher-science-has-the-answer-250656,31,amichail,11 hours ago,2
Switzerland's vinyl turntable roundabout: Unique road art (2019),https://www.newlyswissed.com/turntable-roundabout-in-switzerland/,36,gnabgib,22 hours ago,8
Battle of Takur Ghar Controversy Continues,https://www.airandspaceforces.com/article/battle-of-takur-ghar-controversy-continues/,12,nradov,7 hours ago,0
The blissful Zen of a good side project,https://joshcollinsworth.com/blog/the-blissful-zen-of-a-good-side-project,540,ingve,2 days ago,131
The ADHD body double: A unique tool for getting things done,https://add.org/the-body-double/,341,yamrzou,1 day ago,207
Rules for Negotiating a Job Offer (2016),https://haseebq.com/my-ten-rules-for-negotiating-a-job-offer/,421,yamrzou,1 day ago,200
Show HN: Latitude.sh Databases – Simple PostgreSQL DBaaS on Bare Metal,https://www.latitude.sh/databases,9,gabrielmouallem,15 hours ago,1
NNCP,https://www.complete.org/nncp/,27,nmstoker,1 day ago,2
World's largest wildlife crossing reaches critical milestone. Now what?,https://www.yahoo.com/news/worlds-largest-wildlife-crossing-reaches-100046299.html,75,Stratoscope,1 day ago,78
Exeter's unassuming co-op worker leads double life as 'Lord of the Logos',https://www.devonlive.com/whats-on/whats-on-news/exeters-unassuming-co-op-worker-10039941,192,summoned,1 day ago,67
"North America Is Dripping from Below, Geoscientists Discover",https://www.jsg.utexas.edu/news/2025/04/north-america-is-dripping-from-below-geoscientists-discover/,137,jandrewrogers,1 day ago,36
Understanding Hydration Errors by Building a SSR React Project,https://www.propelauth.com/post/understanding-hydration-errors,22,aisrael,1 day ago,5
A Vision for WebAssembly Support in Swift,https://forums.swift.org/t/pitch-a-vision-for-webassembly-support-in-swift/79060,200,LucidLynx,1 day ago,100
Coolify: Open-source and self-hostable Heroku / Netlify / Vercel alternative,https://coolify.io/,372,vanschelven,2 days ago,173
Database Protocols Are Underwhelming,https://byroot.github.io/performance/2025/03/21/database-protocols.html,109,PaulHoule,1 day ago,29
Let's Ban Billboards,https://iambateman.com/articles/billboards,318,iambateman,8 hours ago,270
"Serving Vector Tiles, Fast",https://spatialists.ch/posts/2025/04-05-serving-vector-tiles-fast/,98,altilunium,1 day ago,17
Show HN: Clawtype v2.1 – a one-hand chorded USB keyboard and mouse [video],https://www.youtube.com/watch?v=N2PSiOl-auM,101,akavel,2 days ago,25
Emulating an iPhone in QEMU,https://eshard.com/posts/emulating-ios-14-with-qemu,258,walterbell,1 day ago,62
